{
  "$schema": "http://json-schema.org/draft-07/schema#",
  "$id": "specification.schema.json",
  "title": "Specification",
  "description": "A FRETISH specification, optionally annotated with fitness metadata produced by the PEREDUR repair tool.",
  "type": "object",
  "required": ["assumptions", "guarantees", "in_atoms", "out_atoms"],
  "additionalProperties": false,
  "properties": {
    "$schema": {
      "type": "string"
    },
    "assumptions": {
      "description": "Assume clauses of the specification.",
      "type": "array",
      "items": { "$ref": "#/$defs/Requirement" }
    },
    "guarantees": {
      "description": "Guarantee clauses of the specification.",
      "type": "array",
      "items": { "$ref": "#/$defs/Requirement" }
    },
    "in_atoms": {
      "description": "Input (uncontrollable) atomic propositions.",
      "type": "array",
      "items": { "type": "string" }
    },
    "out_atoms": {
      "description": "Output (controllable) atomic propositions.",
      "type": "array",
      "items": { "type": "string" }
    },
    "modes": {
      "description": "Operating modes a requirement's scope may be relative to. Their own namespace, disjoint from in_atoms and out_atoms; they join the environment (uncontrollable) side of the synthesis partition. Absent means the specification uses no scopes.",
      "type": "array",
      "items": { "type": "string" }
    },
    "fitness": { "$ref": "#/$defs/FitnessRecord" }
  },
  "$defs": {
    "Requirement": {
      "description": "A single FRETISH requirement with condition, condition-type, response, and timing.",
      "type": "object",
      "required": ["condition", "condition-type", "response", "timing"],
      "additionalProperties": false,
      "properties": {
        "condition": {
          "description": "Propositional formula that activates the requirement.",
          "type": "string"
        },
        "condition-type": {
          "description": "Whether the condition activates on a rising edge (trigger) or at every timepoint it holds (continual).",
          "type": "string",
          "enum": ["trigger", "continual"]
        },
        "response": {
          "description": "Propositional formula that must hold when the condition activates.",
          "type": "string"
        },
        "timing": { "$ref": "#/$defs/Timing" },
        "weakenable": {
          "description": "When false, the genetic algorithm never mutates this requirement or uses it as a crossover source. Defaults to true when absent.",
          "type": "boolean"
        },
        "scope": { "$ref": "#/$defs/Scope" }
      }
    },
    "Scope": {
      "description": "The interval, relative to when a mode holds, over which the requirement is enforced. Absent means Global, which is also what an omitted FRET scope means.",
      "type": "object",
      "required": ["type"],
      "additionalProperties": false,
      "properties": {
        "type": {
          "type": "string",
          "enum": [
            "Global",
            "In",
            "NotIn",
            "Before",
            "After",
            "OnlyIn",
            "OnlyBefore",
            "OnlyAfter"
          ]
        },
        "mode": {
          "description": "Name of the mode, which must appear in the specification's modes list. Required for every type but Global, and forbidden for Global.",
          "type": "string",
          "minLength": 1
        }
      },
      "if": {
        "properties": { "type": { "const": "Global" } }
      },
      "then": { "not": { "required": ["mode"] } },
      "else": { "required": ["mode"] }
    },
    "Timing": {
      "description": "Temporal modifier controlling when the response must hold relative to the condition.",
      "type": "object",
      "required": ["type"],
      "additionalProperties": false,
      "properties": {
        "type": {
          "type": "string",
          "enum": [
            "Immediately",
            "NextTimepoint",
            "WithinTicks",
            "ForTicks",
            "AfterTicks",
            "Eventually",
            "Always",
            "Until",
            "Before"
          ]
        },
        "ticks": {
          "description": "Tick bound; required for WithinTicks, ForTicks, and AfterTicks.",
          "type": "integer",
          "minimum": 0
        },
        "stop": {
          "description": "Propositional stop condition; required for Until and Before.",
          "type": "string"
        }
      },
      "allOf": [
        {
          "if": {
            "properties": {
              "type": { "enum": ["WithinTicks", "ForTicks", "AfterTicks"] }
            }
          },
          "then": { "required": ["ticks"] }
        },
        {
          "if": {
            "properties": { "type": { "enum": ["Until", "Before"] } }
          },
          "then": { "required": ["stop"] }
        }
      ]
    },
    "ComponentScore": {
      "description": "Score and weight for one fitness component.",
      "type": "object",
      "required": ["name", "score", "weight"],
      "additionalProperties": false,
      "properties": {
        "name": {
          "description": "Identifier of the fitness component (e.g. syntactic, semantic, status).",
          "type": "string"
        },
        "score": {
          "description": "Raw score in [0, 1] produced by this component.",
          "type": "number",
          "minimum": 0,
          "maximum": 1
        },
        "weight": {
          "description": "Relative weight used when computing the weighted average.",
          "type": "number",
          "minimum": 0
        }
      }
    },
    "FitnessRecord": {
      "description": "Fitness breakdown produced by the PEREDUR repair tool. Present only on output files, never required on input.",
      "type": "object",
      "required": ["total", "components"],
      "additionalProperties": false,
      "properties": {
        "total": {
          "description": "Weighted average of all component scores, in [0, 1].",
          "type": "number",
          "minimum": 0,
          "maximum": 1
        },
        "components": {
          "description": "Per-component score and weight breakdown.",
          "type": "array",
          "items": { "$ref": "#/$defs/ComponentScore" }
        }
      }
    }
  }
}
