{
  "assumptions": [],
  "guarantees": [
    {
      "condition": "true",
      "condition-type": "trigger",
      "response": "confirm_task_request",
      "timing": {
        "type": "Before",
        "stop": "dressing_process_initiated"
      }
    }
  ],
  "in_atoms": [
    "action_response_time_exceeded",
    "ambiguity_present",
    "background_noise_overpowering",
    "balance_assistance_requested",
    "balance_lost",
    "collision_detected",
    "command_recognition_failed",
    "corrective_action_required",
    "detect_user_request_not_received",
    "different_garment_requested",
    "doubt_present",
    "dressing_process_initiated",
    "dressing_requested",
    "dressing_stage_active",
    "dressing_started",
    "expected_task_duration_exceeded",
    "explicit_validation_from_user",
    "feedback_inconsistency_probability_ge_0p9",
    "garment_already_worn",
    "garment_detection_failed",
    "garment_grip_expected",
    "garment_location_query_issued",
    "garment_movement_delay_detected",
    "garment_presence_detected",
    "gesture_command_detected",
    "gesture_detected",
    "gesture_detection_confidence_le_0p9",
    "high_risk_command",
    "interaction_interruption_required",
    "lost_task_segmentation",
    "pose_detected",
    "pose_detection_requested",
    "pose_update_required",
    "potential_robot_user_collision",
    "required_element_missing_or_unobservable_detected",
    "required_pose_information_still_unavailable",
    "required_pose_information_unavailable",
    "risk_present",
    "second_actor_detected",
    "sensor_validation_complete",
    "speech_commands_incomplete",
    "task_behaviour_inconsistent",
    "task_exception_detected",
    "task_failure_condition",
    "task_or_response_processing_in_progress",
    "task_or_response_processing_started",
    "task_started",
    "task_time_bound_exceeded",
    "trajectory_information_requested",
    "unsuitable_user_pose_detected",
    "user_confirmation_received",
    "user_decision_change_probability_ge_0p9",
    "user_input_correctly_interpreted",
    "user_interaction_delay_detected",
    "user_interaction_ongoing",
    "user_interaction_required",
    "user_interference",
    "user_movement_detected",
    "user_movement_tracked",
    "user_moves_garment",
    "user_out_of_range",
    "user_override_attempt_probability_ge_0p9",
    "user_pose_change_detected",
    "user_removes_garment",
    "user_speech_detected_during_audio_feedback",
    "user_tracking_lost",
    "vision_occluded",
    "wrong_limb_probability_ge_0p9"
  ],
  "out_atoms": [
    "able_to_restart_dressing_sequence",
    "action_taken",
    "advise_pose_improvement",
    "alert_user",
    "appropriate_user_input_requested",
    "audio_feedback_stopped",
    "command_intent_verified",
    "confirm_command",
    "confirm_steps_with_user",
    "confirm_task_request",
    "continue",
    "corrective_action_applied",
    "current_task_and_robot_motion_announced_to_user",
    "current_task_status_provided",
    "delay_reduction_behaviour_activated",
    "dressing_actions_initiated",
    "execution",
    "exit_dressing_sequence",
    "feedback_verified_using_multiple_sensing_modalities",
    "fetch_item",
    "garment_gripped",
    "garment_movement_initiated",
    "gesture_acted_upon",
    "initiate_dressing_process",
    "instructions_clear_and_unambiguous",
    "interaction_recovery_initiated",
    "issue_balance_assistance_query",
    "long_or_infinite_processing_loop",
    "monitor_user_attention",
    "monitor_user_engagement",
    "movement_initiated",
    "multimodal_output_supported",
    "multimodal_pose_detection_active",
    "non_rigid_trajectory_active",
    "notify_already_wearing_garment",
    "notify_noise_confusion",
    "notify_user",
    "notify_user_of_detection_mode",
    "pose_update_need_recognised",
    "pose_update_recognition_delay_detected",
    "process_continuing",
    "process_starting",
    "provide_assistance",
    "query_second_person_presence",
    "query_user_for_garment",
    "remind_user_not_to_move_garment",
    "remind_user_to_not_obstruct_camera_view",
    "remind_user_to_remain_still",
    "request_confirmation",
    "request_garment_verification",
    "request_suitable_pose",
    "request_user_confirmation",
    "request_validated",
    "robot_initiated_interruption",
    "task_continued",
    "task_execution_initiated",
    "task_initiation",
    "task_paused",
    "task_resumed",
    "task_transitioned",
    "timer_checks_active",
    "track_user_position",
    "trajectory_adjusted_to_user_position",
    "trajectory_information_available",
    "trajectory_information_delay_detected",
    "update_garment_selection",
    "updated_user_decision_confirmed",
    "use_multiple_modalities",
    "user_advised_to_present_correct_limb",
    "user_assistance_requested",
    "user_clarification_requested",
    "user_confirmation_requested",
    "user_gesture_confirmation_requested",
    "user_informed_of_delay",
    "user_interaction_initiated",
    "user_interaction_initiated_successfully",
    "user_interaction_supported",
    "user_notified",
    "user_notified_of_delay",
    "user_notified_of_movement_delay",
    "user_notified_of_pose_update_delay",
    "user_notified_of_trajectory_delay",
    "user_or_external_assistance_requested",
    "user_position_estimate_updated",
    "user_presence_validated_by_multiple_sensors",
    "user_prompted_to_repeat_or_clarify_request",
    "user_reminded_to_remain_seated",
    "user_request_executed"
  ],
  "modes": [
    "detection_mode",
    "dressing_mode",
    "task_execution"
  ]
}
